article_id,slug,date,time,is_updated,headline,excerpt,article_url,scraped_at
v-ods-vitezi-pardalove-jako-fiala-stanjura-ci-vondra-ale-mla,politika,2020-01-19,10:38:00,False,"V ODS vítězí ""pardálové"" jako Fiala, Stanjura či Vondra. Mládí si ale začíná stěžovat","Nejsme dostatečně atraktivní pro mladé voliče, na kongresu jsou hlavně vzdělaní, konzervativně smýšlející strýčci a tetičky, upozorňovali mladí v ODS.",/domaci//domaci/politika/v-ods-vitezi-pardalove-jako-fiala-stanjura-ci-vondra-ale-mla/r~84584a683a8611eaa24cac1f6b220ee8/,03-05-2020 19:49:41
r~d3e91b3e322011ea8d520cc47ab5f122,najemne-ve-velkym-mestech-uz-neroste-tak-rychle-zdrazovani-a,2020-01-19,06:31:00,False,Ve zdražování bytů se Česko dál drží na špici EU. Růst nájmů už však začíná zmírňovat,České nemovitosti zdražovaly proti průměru Evropské unie více než dvojnásobně.,/domaci//ekonomika/najemne-ve-velkym-mestech-uz-neroste-tak-rychle-zdrazovani-a/r~d3e91b3e322011ea8d520cc47ab5f122/,03-05-2020 19:49:41
predseda-ods-fiala-bude-na-kongresu-v-praze-obhajovat-mandat,politika,2020-01-18,23:32:00,True,"Předsedou ODS je znovu Fiala. Udženija neuspěla, místopředsedou je Stanjura","Řadovými místopředsedy jsou Alexandr Vondra, Miloš Vystrčil, Martin Kupka a Martin Baxa.",/domaci//domaci/politika/predseda-ods-fiala-bude-na-kongresu-v-praze-obhajovat-mandat/r~803bd21039d211ea9d020cc47ab5f122/,03-05-2020 19:49:41
r~ad5a79c2377011ea858fac1f6b220ee8,hleda-se-stehlikuv-nastupce-nove-to-musi-byt-valecny-veteran,2020-01-18,17:29:00,False,"Hledá se Stehlíkův nástupce. Musí být válečný veterán, požaduje nově ministerstvo","Ministerstvo obrany vyhlásilo výběrové řízení na post ředitele odboru pro válečné veterány, které do konce roku vedl známý historik Eduard Stehlík.",/domaci//domaci/hleda-se-stehlikuv-nastupce-nove-to-musi-byt-valecny-veteran/r~ad5a79c2377011ea858fac1f6b220ee8/,03-05-2020 19:49:41
r~bedab23439fa11ea926e0cc47ab5f122,v-noci-cekejte-mrazy-nejsussi-bude-pristi-tyden-pak-deste-i,2020-01-18,15:00:00,False,"V noci čekejte mrazy, nejsušší bude příští týden, pak deště i sněhu přibude",Průměrný úhrn srážek v Česku pro období od 20. ledna do 16. února je 35 milimetrů.,/domaci//domaci/v-noci-cekejte-mrazy-nejsussi-bude-pristi-tyden-pak-deste-i/r~bedab23439fa11ea926e0cc47ab5f122/,03-05-2020 19:49:41
r~8b122c6e394311eab1410cc47ab5f122,cesko-je-prehlcene-informacni-panely-pro-turisty-jsou-nezaji,2020-01-18,14:06:00,False,"Česko je přehlcené informačními cedulemi, často jsou přitom zbytečné a nezajímavé","Bára Dvořáková ze Sdružení pro interpretaci místního dědictví zkritizovala informační panely, které jsou podle ní zanedbané a je jich příliš.",/domaci//ekonomika/cesko-je-prehlcene-informacni-panely-pro-turisty-jsou-nezaji/r~8b122c6e394311eab1410cc47ab5f122/,03-05-2020 19:49:41
r~445c542c39d711ea9ec9ac1f6b220ee8,do-ceska-se-po-trech-letech-vratila-ptaci-chripka-nakaza-je,2020-01-18,13:22:00,True,"Do Česka se po třech letech vrátila ptačí chřipka, nákaza je v malochovu na Vysočině",Přenos na člověka nebyl dosud zaznamenán.,/domaci//domaci/do-ceska-se-po-trech-letech-vratila-ptaci-chripka-nakaza-je/r~445c542c39d711ea9ec9ac1f6b220ee8/,03-05-2020 19:49:41
r~8d2ae1c239ec11ea926e0cc47ab5f122,spolecne-proti-babisove-vlade-opozicni-lidri-vyzvali-ods-k-j,2020-01-18,13:18:00,False,Společně proti Babišově vládě. Opoziční lídři vyzvali ODS k jednotné cestě,"Podle předsedkyně TOP 09 Markéty Pekarové Adamové budou sněmovní volby za necelé dva roky milníkem, který může být bodem zlomu.",/domaci//domaci/spolecne-proti-babisove-vlade-opozicni-lidri-vyzvali-ods-k-j/r~8d2ae1c239ec11ea926e0cc47ab5f122/,03-05-2020 19:49:41
,r~e3f52d74377a11eaa24cac1f6b220ee8,2020-01-18,09:49:00,True,"Na velké popularitě Vondry nevidím nic divného, říká Fiala před kongresem ODS","""Od kongresu si slibuji, že ODS pomůže přeřadit v naší jízdě do příštích voleb na vyšší rychlostní stupeň,"" sdělil Alexandr Vondra Aktuálně.cz.",/domaci//na-velke-podpore-vondry-nevidim-nic-divneho-rika-fiala-pred/r~e3f52d74377a11eaa24cac1f6b220ee8/,03-05-2020 19:49:41
r~25de778a36e611eaac760cc47ab5f122,cvvm-pro-progresivni-zdaneni-prijmu-je-nejmene-cechu-od-roku,2020-01-18,06:37:00,False,"Vyšší plat = vyšší daně? Bohatnoucí Češi mění názor, spojuje je pocit nespravedlnosti","Průzkum CVVM ukázal, že progresivní zdanění příjmů sice podporuje nejméně obyvatel od roku 2002, stále jde ale o 55 procent lidí.",/domaci//ekonomika/cvvm-pro-progresivni-zdaneni-prijmu-je-nejmene-cechu-od-roku/r~25de778a36e611eaac760cc47ab5f122/,03-05-2020 19:49:41
manzel-vyhozene-urednice-chtel-box-s-mistostarostou,praha,2020-01-17,20:33:00,False,"Manžel vyhozené úřednice chtěl box s místostarostou. Politik souhlasil, teď žádá kord","Úřednice nedobrovolně skončila poté, co žádala od místostarosty Tomáše Tatranského omluvu za jeho vulgární urážky na služební cestě.",/domaci//regiony/praha/manzel-vyhozene-urednice-chtel-box-s-mistostarostou/r~8efbd8fa393611ea8776ac1f6b220ee8/,03-05-2020 19:49:41
r~3fbea79c395211ea9b40ac1f6b220ee8,statni-zastupce-zastavil-stihani-zastupitelu-prahy-1-kvuli-p,2020-01-17,18:59:00,True,Státní zástupce zastavil stíhání zastupitelů Prahy 1 kvůli privatizaci bytů,Obvinění se týkalo hlasování o privatizaci bytů v minulých volebních obdobích.,/domaci//domaci/statni-zastupce-zastavil-stihani-zastupitelu-prahy-1-kvuli-p/r~3fbea79c395211ea9b40ac1f6b220ee8/,03-05-2020 19:49:42
r~a361aa30391411ea8d520cc47ab5f122,babis-valkova-to-dela-dobre-kdyby-se-ji-rada-nezastala-tak-j,2020-01-17,18:17:00,True,"Babiš: Válková to dělá dobře. Kdyby se jí rada nezastala, tak ji odvoláme",Rada pro lidská práva uznává přínos Válkové na prosazování lidskoprávní agendy a zefektivnění činnosti rady.,/domaci//domaci/babis-valkova-to-dela-dobre-kdyby-se-ji-rada-nezastala-tak-j/r~a361aa30391411ea8d520cc47ab5f122/,03-05-2020 19:49:42
radeni-zlodejskeho-gangu-ustalo-deti-se-ale-stale-boji,stredocesky,2020-01-17,16:21:00,False,"Řádění zlodějského gangu ustalo. Děti se ale stále bojí chodit domů, říkají místní","Policie se domnívá, že zloděje, kteří vykradli desítky domů, mohl odradit zvýšení počet hlídek v postižených obcích.",/domaci//regiony/stredocesky/radeni-zlodejskeho-gangu-ustalo-deti-se-ale-stale-boji/r~0b3beffc387611eaac60ac1f6b220ee8/,03-05-2020 19:49:42
vetsina-kandidatu-na-prezidenta-chybovala-ve-financovani-kam,politika,2020-01-17,16:08:00,True,Úřad prověří kampaně šesti kandidátů na prezidenta. Jediný Zeman pokutu dostat nemůže,"Podle rozhlasu mají chyby ve financování Jiří Drahoš, Pavel Fischer a Marek Hilšer, Mirek Topolánek, Michal Horáček i prezident Miloš Zeman.",/domaci//domaci/politika/vetsina-kandidatu-na-prezidenta-chybovala-ve-financovani-kam/r~d99e1e6c390011eaac760cc47ab5f122/,03-05-2020 19:49:42
r~2ed831c2390d11ea84260cc47ab5f122,babis-zakazka-k-dalnicnim-znamkam-byla-spatne-zorganizovana,2020-01-17,15:40:00,True,Kremlík nezruší zakázku na e-shop k dálničním známkám. Babiš postup resortu kritizuje,"Babiš ještě před jednáním s Kremlíkem uvedl, že by se měla zakázka zrušit. Ministr to však odmítl a uvedl, že bude hledat cesty k jejímu zlevnění.",/domaci//ekonomika/babis-zakazka-k-dalnicnim-znamkam-byla-spatne-zorganizovana/r~2ed831c2390d11ea84260cc47ab5f122/,03-05-2020 19:49:42
r~2e74ff7435f411eab259ac1f6b220ee8,potravinarske-retezce-planuji-i-letos-zvysovat-mzdy,2020-01-17,15:33:00,False,"Boj o prodavače pokračuje. Řetězce zvednou mzdy o desetinu, stále to však nestačí","Podle odborů je zásadní, aby byla zvyšována základní mzda a nově nastupující zaměstnanci neměli vyšší mzdu než stávající na stejné pozici.",/domaci//ekonomika/potravinarske-retezce-planuji-i-letos-zvysovat-mzdy/r~2e74ff7435f411eab259ac1f6b220ee8/,03-05-2020 19:49:42
r~87254dfe392d11ea9ec9ac1f6b220ee8,exreditel-liberecke-nemocnice-necesany-zada-jineho-soudce-ln,2020-01-17,15:07:00,False,"Manželé Nečesaní žádají ve své kauze jiného soudce, Lněnička soudil jejich syna","Soud proto musel odvolat zasedání, které původně nařídil na 22. ledna.",/domaci//domaci/exreditel-liberecke-nemocnice-necesany-zada-jineho-soudce-ln/r~87254dfe392d11ea9ec9ac1f6b220ee8/,03-05-2020 19:49:42
r~52830906392311ea84260cc47ab5f122,muz-ktery-strilel-na-auto-a-cisternu-je-ve-vazbe,2020-01-17,13:40:00,False,"Muž, který střílel na auto a cisternu, je ve vazbě. Hrozí mu až 20 let vězení",Za pokus o vraždu a obecné ohrožení hrozí muži 15 až 20 let vězení nebo výjimečný trest.,/domaci//domaci/muz-ktery-strilel-na-auto-a-cisternu-je-ve-vazbe/r~52830906392311ea84260cc47ab5f122/,03-05-2020 19:49:42
r~4a4d55b4386711eaac760cc47ab5f122,kubera-cina-novej-rok,2020-01-17,11:04:00,False,"Kubera se zúčastní oslav čínského nového roku, akci mají v režii čínské vládní orgány","Předseda Senátu Jaroslav Kubera přijal pozvání na oslavy čínského nového roku ze ""zdvořilosti"", propagandistické pozadí akce neřešil.",/domaci//domaci/kubera-cina-novej-rok/r~4a4d55b4386711eaac760cc47ab5f122/,03-05-2020 19:49:42
r~45a599e8390911ea9d020cc47ab5f122,ncoz-propustila-ze-sluzby-dustojnika-kvuli-tomu-ze-spoluprac,2020-01-17,10:12:00,False,"NCOZ propustila ze služby důstojníka kvůli tomu, že spolupracoval s Piráty",Důstojník NCOZ Jan Šmíd podle rozhodnutí vedení útvaru jednal ve prospěch politické strany. U útvaru sloužil něco málo přes dva roky.,/domaci//domaci/ncoz-propustila-ze-sluzby-dustojnika-kvuli-tomu-ze-spoluprac/r~45a599e8390911ea9d020cc47ab5f122/,03-05-2020 19:49:42
r~f20d6f5c385b11ea82ef0cc47ab5f122,rodiny-zachranit-divky-z-korejske-cirkve-sincchondzi,2020-01-17,05:30:00,False,"Příbuzní chtějí získat zpět dívky, které propadly korejské sektě. Ztrácíme je, říkají","Skutečný počet členů české pobočky církve Šinčchondži je stále obestřen tajemstvím. Přibývá však těch, kdo se o své zkušenosti s ní nebojí mluvit.",/domaci//domaci/rodiny-zachranit-divky-z-korejske-cirkve-sincchondzi/r~f20d6f5c385b11ea82ef0cc47ab5f122/,03-05-2020 19:49:42
r~78890782388711ea8776ac1f6b220ee8,helena-valkova-zustava-na-postu-vladni-zmocnenkyne-pro-lidsk,2020-01-16,22:08:00,True,"Válková zůstává na postu vládní zmocněnkyně pro lidská práva, o rezignaci neuvažovala",Podpořila ji většina členů rady vlády pro lidská práva.,/domaci//domaci/helena-valkova-zustava-na-postu-vladni-zmocnenkyne-pro-lidsk/r~78890782388711ea8776ac1f6b220ee8/,03-05-2020 19:49:42
r~8a3f1ac2387111ea82ef0cc47ab5f122,chodi-na-zakladku-a-uz-maji-svetove-uspechy-to-jsou-nejtalen,2020-01-16,19:53:00,False,Chodí na základku a už mají světové úspěchy. To jsou nejtalentovanější malí Češi 2019,"Osmiletý mistr světa v šachu, desetiletý akordeonista hrající na konzervatoři či houslový virtuos, který ve 14 letech studuje Vídeňskou univerzitu.",/domaci//domaci/chodi-na-zakladku-a-uz-maji-svetove-uspechy-to-jsou-nejtalen/r~8a3f1ac2387111ea82ef0cc47ab5f122/,03-05-2020 19:49:42
r~d4974ca6388111eaac760cc47ab5f122,cesti-i-evropsti-politici-u-pamatniku-pred-narodnim-muzeem-v,2020-01-16,19:27:00,True,Vzpomínka na Jana Palacha. Před Národním muzeem se sešli čeští i evropští politici,"K památníku sebeupálení studenta položili věnce premiéři V4, Sebastian Kurz, předseda Senátu Kubera i historik Petr Blažek.",/domaci//domaci/cesti-i-evropsti-politici-u-pamatniku-pred-narodnim-muzeem-v/r~d4974ca6388111eaac760cc47ab5f122/,03-05-2020 19:49:42
r~41bbec28388811eaa24cac1f6b220ee8,zeman-mozna-cinu-letos-na-jare-navstivi-ale-jen-pri-podepsan,2020-01-16,19:15:00,False,"Zeman by mohl návštěvu Číny ještě zvážit, ale jen při podepsání konkrétních projektů","Oznámil ve čtvrtek jeho kancléř Vratislav Mynář. Uvedl, že prezident je o návštěvě ochoten za určitých podmínek ještě uvažovat.",/domaci//domaci/zeman-mozna-cinu-letos-na-jare-navstivi-ale-jen-pri-podepsan/r~41bbec28388811eaa24cac1f6b220ee8/,03-05-2020 19:49:42
r~d528e202386c11ea82ef0cc47ab5f122,vztahy-s-rakouskem-posili-dostavba-dalnic-rekl-babis,2020-01-16,17:09:00,False,"Vztahy s Rakouskem posílí dostavba dálnic, řekl Babiš po jednání lídrů V4 a Rakouska",Premiéři V4 a Rakouska se shodli i na společném postoji vůči migraci a rozšiřování EU směrem na Balkán.,/domaci//domaci/vztahy-s-rakouskem-posili-dostavba-dalnic-rekl-babis/r~d528e202386c11ea82ef0cc47ab5f122/,03-05-2020 19:49:42
r~b87dfcb4387111ea82ef0cc47ab5f122,cesi-loni-uzavreli-dosud-nejvyssi-pocet-manzelskych-smluv,2020-01-16,16:16:00,False,"Češi loni uzavřeli dosud nejvyšší počet manželských smluv, uvádí Notářská komora",Smlouva předběžně řeší majetkové poměry pro případ rozvodu či úmrtí jednoho z manželů.,/domaci//domaci/cesi-loni-uzavreli-dosud-nejvyssi-pocet-manzelskych-smluv/r~b87dfcb4387111ea82ef0cc47ab5f122/,03-05-2020 19:49:42
r~ec6165c0386c11eab259ac1f6b220ee8,uohs-zacal-posuzovat-nakup-ondrasovky-a-korunni-kofolou,2020-01-16,15:46:00,False,"Kofola usiluje o koupi firem Ondrášovka a Korunní, transakci prověří ÚOHS",Transakci oznámili zástupci společností loni v prosinci.,/domaci//ekonomika/uohs-zacal-posuzovat-nakup-ondrasovky-a-korunni-kofolou/r~ec6165c0386c11eab259ac1f6b220ee8/,03-05-2020 19:49:44
r~c021f132386711ea84260cc47ab5f122,uplatek-metrostavu-pro-ratha-by-byl-vyssi-nez-zisk-firmy,2020-01-16,15:31:00,False,"Úplatek Metrostavu pro Ratha by byl vyšší než zisk firmy, brání advokát ředitele","Žalobce navrhl řediteli Metrostavu Pavlu Pilátovi pětiletý trest, pokutu 1,5 milionu korun a čtyřletý zákaz působit ve vedení společností.",/domaci//domaci/uplatek-metrostavu-pro-ratha-by-byl-vyssi-nez-zisk-firmy/r~c021f132386711ea84260cc47ab5f122/,03-05-2020 19:49:44
r~e8188600385e11eaac760cc47ab5f122,brabec-cr-nebude-zavadet-system-zalohovani-pet-lahvi,2020-01-16,15:06:00,True,"Plošné zálohování PET lahví nebude, řekl Brabec. Podle něj by stálo miliardy","Ministr životního prostředí Richard Brabec také uvedl, že současný systém sběru považuje za funkční a daří se plnit evropské cíle.",/domaci//ekonomika/brabec-cr-nebude-zavadet-system-zalohovani-pet-lahvi/r~e8188600385e11eaac760cc47ab5f122/,03-05-2020 19:49:44
ostravska-nemocnice-po-utoku-strelce-rozsiri-kamerovy-system,moravskoslezsky,2020-01-16,14:25:00,False,Ostravská nemocnice po útoku střelce rozšíří kamerový systém a pořídí zamykací dveře,"V nemocnici útočník střílel 10. prosince, zabil sedm lidí a dva zranil. Později spáchal sebevraždu.",/domaci//regiony/moravskoslezsky/ostravska-nemocnice-po-utoku-strelce-rozsiri-kamerovy-system/r~5606d41e386411eaa24cac1f6b220ee8/,03-05-2020 19:49:44
pacient-ve-slanske-nemocnici-napadl-v-noci-personal-nozem-pr,stredocesky,2020-01-16,13:22:00,True,"Pacient ve slánské nemocnici napadl v noci personál, ochranka ho postřelila do nohy",Muž je podezřelý z ublížení na zdraví ve stadiu pokusu.,/domaci//regiony/stredocesky/pacient-ve-slanske-nemocnici-napadl-v-noci-personal-nozem-pr/r~2e7c8b04383811eaac760cc47ab5f122/,03-05-2020 19:49:44
r~c57ef22e385811ea926e0cc47ab5f122,soud-zamitl-obnovu-40-let-stareho-pripadu-disidenta-wonky,2020-01-16,13:17:00,False,Disident Wonka zemřel v 35 letech v komunistickém žaláři. Obnovu případu soud zamítl,"Pavel Wonka je označován za posledního politického vězně komunistického režimu v Československu, který zemřel ve vězení.",/domaci//domaci/soud-zamitl-obnovu-40-let-stareho-pripadu-disidenta-wonky/r~c57ef22e385811ea926e0cc47ab5f122/,03-05-2020 19:49:44
r~6a238894385411ea88f50cc47ab5f122,kritizovanou-sochu-zpevacky-spinarove-ostrava-zrejme-na-jare,2020-01-16,12:42:00,False,Kritizovanou sochu zpěvačky Špinarové Ostrava zřejmě na jaře prodá v aukci,"Socha měla řadu kritiků, ohradil se proti ní i syn zpěvačky Adam Pavlík.",/domaci//domaci/kritizovanou-sochu-zpevacky-spinarove-ostrava-zrejme-na-jare/r~6a238894385411ea88f50cc47ab5f122/,03-05-2020 19:49:44
r~68545f84384511eaa24cac1f6b220ee8,prazske-letiste-loni-odbavilo-rekordnich-17-8-milionu-cestuj,2020-01-16,11:14:00,False,Letiště v Praze loni odbavilo rekordní počet osob. S přetlakem má pomoci modernizace,"Počet cestovatelů by měl růst i letos, čímž se letiště ocitne za hranou své kapacity. V plánu je několik projektů, které by měly zrychlit provoz.",/domaci//ekonomika/prazske-letiste-loni-odbavilo-rekordnich-17-8-milionu-cestuj/r~68545f84384511eaa24cac1f6b220ee8/,03-05-2020 19:49:44
r~c179756e383a11eab259ac1f6b220ee8,krecek-ma-potrebne-zkusenosti-na-ombudsmana-tvrdi-zeman,2020-01-16,09:47:00,False,"Křeček má potřebné zkušenosti na funkci ombudsmana, tvrdí Zeman po jeho nominaci","Prezident loni dvakrát neúspěšně navrhoval, aby Křeček pokračoval ve funkci zástupce ombudsmanky.",/domaci//domaci/krecek-ma-potrebne-zkusenosti-na-ombudsmana-tvrdi-zeman/r~c179756e383a11eab259ac1f6b220ee8/,03-05-2020 19:49:44
r~71f7329636e211eaac60ac1f6b220ee8,sociolozka-vymena-manzelek-soutezici-zostuzuje-napomaha-tak,2020-01-16,06:16:00,False,"Socioložka: Výměna manželek účastníky zostuzuje, prohlubuje tak rozdělení společnosti","Socioložka Irena Reifová v rozhovoru pro Aktuálně.cz tvrdí, že pořady žánru reality show záměrně zostuzují své účinkující.",/domaci//domaci/sociolozka-vymena-manzelek-soutezici-zostuzuje-napomaha-tak/r~71f7329636e211eaac60ac1f6b220ee8/,03-05-2020 19:49:44
obnoveni-stihani-babise-se-projednavalo-v-evropskem-parlamen,politika,2020-01-15,20:38:00,False,Obnovení stíhání Babiše se projednávalo v Evropském parlamentu,"Němka Monika Hohlmeierová zdůraznila, že podezření ze zneužívání evropských dotací není ""interní"" českou věcí.",/domaci//domaci/politika/obnoveni-stihani-babise-se-projednavalo-v-evropskem-parlamen/r~b50c809a37cd11ea84260cc47ab5f122/,03-05-2020 19:49:44
r~5f0511aa37a811ea84260cc47ab5f122,ceska-ma-cukrovku-a-hraje-americky-fotbal-hlida-ji-specialni,2020-01-15,18:53:00,False,"Je to třetí historický milník pro lidi s cukrovkou, říká lékař o nových senzorech","Když Kateřině Vargové (22) příliš klesne či příliš stoupne hladina glukózy v krvi, přístroj ji včas upozorní.",/domaci//domaci/ceska-ma-cukrovku-a-hraje-americky-fotbal-hlida-ji-specialni/r~5f0511aa37a811ea84260cc47ab5f122/,03-05-2020 19:49:44
babis-v-brne-nasliboval-miliardy-na-novou-porodnici-i-na-puj,jihomoravsky,2020-01-15,17:00:00,False,Babiš v Brně nasliboval miliardy. Na novou porodnici i na půjčku zadlužené nemocnici,"Stavba nové porodnice by měla stát 1,9 miliardy korun. Fakultní nemocnice u svaté Anny pak má dostat půjčku 1,3 miliardy, kterou bude splácet.",/domaci//regiony/jihomoravsky/babis-v-brne-nasliboval-miliardy-na-novou-porodnici-i-na-puj/r~b63461b837a011ea9d020cc47ab5f122/,03-05-2020 19:49:44
r~9a5b7baa37a211ea8d520cc47ab5f122,v-cesku-byl-zacatkem-roku-viditelny-mimoradne-jasny-bolid,2020-01-15,15:45:00,False,Mimořádně jasný bolid pozorovaný i v Česku svítil stokrát víc než Měsíc v úplňku,Bolid podle astronomů letěl nad severním až severovýchodním obzorem zhruba devět vteřin a za tu dobu urazil  155 kilometrů.,/domaci//domaci/v-cesku-byl-zacatkem-roku-viditelny-mimoradne-jasny-bolid/r~9a5b7baa37a211ea8d520cc47ab5f122/,03-05-2020 19:49:44
r~c3714b8c378911eab1410cc47ab5f122,krecek-neni-stastna-volba-na-ombudsmana-rika-sabatova,2020-01-15,15:41:00,True,"Křeček není šťastná volba na ombudsmana, kandidáti Senátu jsou lepší, říká Šabatová",Nového veřejného ochránce práv bude volit v únoru Poslanecká sněmovna.,/domaci//domaci/krecek-neni-stastna-volba-na-ombudsmana-rika-sabatova/r~c3714b8c378911eab1410cc47ab5f122/,03-05-2020 19:49:46
r~ea670ea237a211eaac60ac1f6b220ee8,zalobce-navrhl-rathovi-v-druhe-vetvi-korupcni-kauzy-souhrnny,2020-01-15,15:28:00,False,Žalobce navrhl Rathovi i Kottovým v druhé kauze delší trest a propadnutí majetku,"Spolu s bývalým hejtmanem a manželi Kottovými je v případu obžalováno ještě šest lidí, například generální ředitel stavební společnosti Metrostav.",/domaci//domaci/zalobce-navrhl-rathovi-v-druhe-vetvi-korupcni-kauzy-souhrnny/r~ea670ea237a211eaac60ac1f6b220ee8/,03-05-2020 19:49:46
svastika-je-i-na-narodni-pamatce-usti-nad-orlici-resi-nejvet,pardubicky,2020-01-15,14:04:00,False,Nacistickými symboly a polskými nápisy vandalové poničili budovy v Ústí nad Orlicí,"Na budovy vandal nasprejoval dva blesky, symbol nacistických jednotek SS, nebo nápis A.C.A.B.",/domaci//regiony/pardubicky/svastika-je-i-na-narodni-pamatce-usti-nad-orlici-resi-nejvet/r~7bf4dd74379211eaac760cc47ab5f122/,03-05-2020 19:49:46
r~c3f2f22c378e11ea84c6ac1f6b220ee8,domovy-pro-postizene-dal-pripominaji-vic-ustav-nez-domov,2020-01-15,13:36:00,False,"Domovy pro postižené dál připomínají víc ústav než domov, kritizuje ombudsmanka",Podle Anny Šabatové často nemají postižení v domovech potřebné soukromí a nemohou rozhodovat třeba ani o svém oblečení.,/domaci//domaci/domovy-pro-postizene-dal-pripominaji-vic-ustav-nez-domov/r~c3f2f22c378e11ea84c6ac1f6b220ee8/,03-05-2020 19:49:46
r~c2bf5454378e11ea84c6ac1f6b220ee8,soud-znovu-posuzuje-janouskovu-zadost-o-obnovu-procesu,2020-01-15,13:22:00,False,"Soud znovu posuzuje Janouškovu žádost o obnovu procesu, předvolá manželku a terapeuta",Zamítnutou žádost o obnovu procesu vrátil k novému projednání Ústavní soud.,/domaci//domaci/soud-znovu-posuzuje-janouskovu-zadost-o-obnovu-procesu/r~c2bf5454378e11ea84c6ac1f6b220ee8/,03-05-2020 19:49:46
r~e15aa9ba36ec11eaa24cac1f6b220ee8,hn-vyrobce-caju-jemcu-jemnice-kupuje-dr-muller-pharma,2020-01-15,13:04:00,False,"Od Tomana do Asie a zpět. Čaje Jemča se vrátily do českých rukou, pro Indy byly malé",Firma Müller Pharma chce investovat do rozvoje této značky čajů. Poslední roky byly pro Jemču ztrátové.,/domaci//ekonomika/hn-vyrobce-caju-jemcu-jemnice-kupuje-dr-muller-pharma/r~e15aa9ba36ec11eaa24cac1f6b220ee8/,03-05-2020 19:49:46
r~483292b6377811ea9ec9ac1f6b220ee8,porad-tyden-s-prezidentem-na-barrandove-konci-vycerpal-svuj,2020-01-15,12:28:00,True,"Pořad Týden s prezidentem na Barrandově končí. Vyčerpal svůj potenciál, řekl Ovčáček","Pořad pro prezidenta byl v minulých letech přínosný, ale pro léta 2020 až 2023 je podle Ovčáčka situace již odlišná.",/domaci//domaci/porad-tyden-s-prezidentem-na-barrandove-konci-vycerpal-svuj/r~483292b6377811ea9ec9ac1f6b220ee8/,03-05-2020 19:49:46
r~ed0b24d00f8a11eab1410cc47ab5f122,experti-tendr-na-portal-verejnych-zakazek-za-150-milionu-je,2020-01-15,11:17:00,True,Experti: Zakázka na web veřejných zakázek za 150 milionů je šitá na míru jedné firmě,"Zakázka za 150 milionů na provoz systému, který má státu zajistit lepší vypisování veřejných zakázek, je podle expertů ušitá na míru jediné firmě.",/domaci//domaci/experti-tendr-na-portal-verejnych-zakazek-za-150-milionu-je/r~ed0b24d00f8a11eab1410cc47ab5f122/,03-05-2020 19:49:46
r~2d78cb06376f11eaac60ac1f6b220ee8,cesko-chce-vypustit-do-vesmiru-vlastni-datove-druzice,2020-01-15,09:44:00,False,"Česko chce vypustit do vesmíru vlastní datové družice, poslouží armádě i NATO","Tuzemské satelitní centrum začalo plně fungovat letos, patří pod Vojenské zpravodajství.",/domaci//domaci/cesko-chce-vypustit-do-vesmiru-vlastni-datove-druzice/r~2d78cb06376f11eaac60ac1f6b220ee8/,03-05-2020 19:49:46
r~87067cf636f511eaa24cac1f6b220ee8,zeman-poklepal-kuberovi-holi-po-hlave-bylo-to-prijemne-rekl,2020-01-15,09:37:00,True,"Lepší scénka než se Sobotkou, hodnotil Kubera oběd na Hradě. Zeman ho poklepal holí",Na společném obědě s prezidentem a předsedou Senátu byl také předseda Poslanecké sněmovny Radek Vondráček.,/domaci//domaci/zeman-poklepal-kuberovi-holi-po-hlave-bylo-to-prijemne-rekl/r~87067cf636f511eaa24cac1f6b220ee8/,03-05-2020 19:49:46
r~c1cb1b7a36fb11ea84260cc47ab5f122,stravenkovy-pausal-bude-podle-navrhu-alternativou-ke-straven,2020-01-15,08:52:00,True,Stravenky nekončí. Benefit ale budou moct zaměstnanci čerpat i jako nedaněný příjem,Se stravenkovým paušálem nesouhlasí například odboráři a Asociace provozovatelů poukázkových systémů.,/domaci//ekonomika/stravenkovy-pausal-bude-podle-navrhu-alternativou-ke-straven/r~c1cb1b7a36fb11ea84260cc47ab5f122/,03-05-2020 19:49:46
r~e498259436ce11ea9d020cc47ab5f122,proti-valkove-se-ozyvaji-clenove-dalsich-rad-vlady,2020-01-15,05:30:00,False,"Proti Válkové se ozývají členové dalších rad vlády. Konat musí premiér, říká Zaorálek","Helenu Válkovou kritizují i členové dalších poradních orgánů vlády, odstoupit by měla podle kolegů z rady pro neziskovky či pro rovnost mužů a žen.",/domaci//domaci/proti-valkove-se-ozyvaji-clenove-dalsich-rad-vlady/r~e498259436ce11ea9d020cc47ab5f122/,03-05-2020 19:49:46
praha-1-ma-novou-a-nezvyklou-koalici-v-centru-metropole-povl,praha,2020-01-14,22:29:00,True,"Bouřlivá Praha 1. Odvolaného Čižinského nahradil Hejma, v radě budou trestně stíhaní","Blok My, co tady žijeme (STAN, TOP 09, KDU-ČSL, Iniciativa občanů) bude vládnout spolu s ODS a ANO. Z vedení mizí Piráti a Praha 1 sobě.",/domaci//regiony/praha/praha-1-ma-novou-a-nezvyklou-koalici-v-centru-metropole-povl/r~cada779836d211ea9b40ac1f6b220ee8/,03-05-2020 19:49:46
