article_id,slug,date,time,is_updated,headline,excerpt,article_url,scraped_at
r~4c7213da6cd711ea80e60cc47ab5f122,online-koronavirus-karantena-cesko,2020-03-27,23:02:00,True,"USA hlásí přes 100 tisíc nakažených, Babiš chce o měsíc prodloužit nouzový stav","Nouzový stav, který zatím platí do 11. dubna, bude potřeba prodloužit, řekl premiér Andrej Babiš. Události sledujeme v on-line reportáži.",/domaci//domaci/online-koronavirus-karantena-cesko/r~4c7213da6cd711ea80e60cc47ab5f122/,03-05-2020 19:48:28
r~c040758c6f7911ea9c800cc47ab5f122,rehka-nukib-kazen,2020-03-27,19:13:00,False,"Poslanec připomněl kázeňské řízení kvůli Zaorálkovi. Je to minulost, reaguje generál","Než vláda jmenovala generála Karla Řehku ředitelem NÚKIB, poslanec SPD chtěl vědět, jak s ním dopadlo kázeňské řízení kvůli kritice Lubomíra Zaorálka.",/domaci//domaci/rehka-nukib-kazen/r~c040758c6f7911ea9c800cc47ab5f122/,03-05-2020 19:48:28
r~2c44088c6ea011eaa7deac1f6b220ee8,vlada-vitala-zasilky-z-ciny-mnohe-ceske-firmy-o-pomoc-doted,2020-03-27,18:25:00,False,"Vláda vítala zásilky z Číny. Nás o pomoc nežádá, stěžují si výrobci masek a obleků","Aktuálně.cz zmapovalo, že výrobce špičkových ochranných obleků ministerstva zdravotnictví ani vnitra neoslovila. Dodávají do zahraničí.",/domaci//domaci/vlada-vitala-zasilky-z-ciny-mnohe-ceske-firmy-o-pomoc-doted/r~2c44088c6ea011eaa7deac1f6b220ee8/,03-05-2020 19:48:28
r~27d16728704811ea842f0cc47ab5f122,nektere-domovy-senioru-nedokazi-splnit-narizeni-o-izolaci,2020-03-27,18:00:00,False,Nařízení o izolaci některé domovy seniorů nemohou splnit. Virus je v šesti zařízeních,"Ministerstvo zdravotnictví nařídilo domovům, aby vyčlenily oddělené pokoje či umývárny a další prostory pro lidi s podezřením na nákazu koronavirem.",/domaci//domaci/nektere-domovy-senioru-nedokazi-splnit-narizeni-o-izolaci/r~27d16728704811ea842f0cc47ab5f122/,03-05-2020 19:48:28
r~7307310e703a11eab1110cc47ab5f122,mozna-delame-reklamu-necemu-co-ani-nefunguje-rika-o-remdesiv,2020-03-27,16:46:00,False,"Možná děláme reklamu něčemu, co ani nefunguje, říká o remdesiviru pacientův lékař","Lékař upozorňuje, že se stav jeho pacienta zlepšoval ještě před podáním léku. Nelze tedy určit, jaký vliv v uzdravování má právě remsedivir.",/domaci//domaci/mozna-delame-reklamu-necemu-co-ani-nefunguje-rika-o-remdesiv/r~7307310e703a11eab1110cc47ab5f122/,03-05-2020 19:48:28
r~b78eb5b6702811eab115ac1f6b220ee8,proti-financni-pomoci-na-boj-s-koronavirem-hlasoval-david,2020-03-27,15:18:00,False,"Proti finanční pomoci na boj s koronavirem hlasoval jediný europoslanec, David z SPD","Český europoslanec byl jediným, kdo nepodpořil návrhy na okamžitou pomoc zemím zasaženým koronavirem, včetně 1,2 miliardy eur pro Česko.",/domaci//domaci/proti-financni-pomoci-na-boj-s-koronavirem-hlasoval-david/r~b78eb5b6702811eab115ac1f6b220ee8/,03-05-2020 19:48:28
r~fbe36a626f4311ea8b230cc47ab5f122,vlady-se-v-boji-s-koronavirem-uchyluji-k-technologiim-aplika,2020-03-27,13:58:00,False,Chytrá karanténa a boj s virem pomocí technologií. Aplikaci vyvíjejí i na ČVUT,"Svět řeší, jak po konci karantény hlídat šíření koronaviru. Jednou z možností je dohled přes mobil, další řešení nabízí umělá inteligence.",/domaci//zahranici/vlady-se-v-boji-s-koronavirem-uchyluji-k-technologiim-aplika/r~fbe36a626f4311ea8b230cc47ab5f122/,03-05-2020 19:48:28
r~ac93dde0700411ea95caac1f6b220ee8,zadne-zapasy-ani-zavody-na-to-jak-se-sport-vyporada-s-epidem,2020-03-27,13:17:00,True,"Řeším s ministerstvem, aby se zákaz netýkal některých sportů venku, říká Hnilička",V chatu se čtenáři Aktuálně.cz odpovídal šéf Národní sportovní agentury.,/domaci//domaci/zadne-zapasy-ani-zavody-na-to-jak-se-sport-vyporada-s-epidem/r~ac93dde0700411ea95caac1f6b220ee8/,03-05-2020 19:48:28
r~950162de6f7c11ea9d470cc47ab5f122,je-to-jako-sacek-do-vysavace-stezuji-si-zdravotnici-respirat,2020-03-27,07:29:00,False,Na respirátory z Číny si někteří zdravotníci stěžují. Podle testu jsou však v pořádku,Nemocnice si naproti tomu ve většině případů dodávku z Číny pochvalují.,/domaci//domaci/je-to-jako-sacek-do-vysavace-stezuji-si-zdravotnici-respirat/r~950162de6f7c11ea9d470cc47ab5f122/,03-05-2020 19:48:28
r~897b1c0c6f6311eaaabd0cc47ab5f122,uz-nejsou-navstevni-hodiny-deti-nedostanete-hadala-se-sestra,2020-03-26,18:54:00,False,"Už nejsou návštěvní hodiny, děti nedostanete, hádala se sestra bez roušky s matkou","Spor o vydání dětí do péče matky se podle zjištění Aktuálně.cz odehrál v mostecké nemocnici, zasahovat musela městská policie.",/domaci//domaci/uz-nejsou-navstevni-hodiny-deti-nedostanete-hadala-se-sestra/r~897b1c0c6f6311eaaabd0cc47ab5f122/,03-05-2020 19:48:28
r~72c8fed46f8611eaa7deac1f6b220ee8,prazsky-registr-vozidel-je-prehlceny-kvuli-nouzovemu-stavu-f,2020-03-26,18:34:00,True,"Pražský registr vozidel je přehlcený, kvůli nouzovému stavu funguje jen dva dny","Motoristé, kterým řidičský průkaz propadl během nouzového stavu, mohou řídit dál.",/domaci//domaci/prazsky-registr-vozidel-je-prehlceny-kvuli-nouzovemu-stavu-f/r~72c8fed46f8611eaa7deac1f6b220ee8/,03-05-2020 19:48:28
r~e44517ba6f8011eaaabd0cc47ab5f122,mimoradny-cin-ministryne-ocenila-zachranu-zivota-a-navrhla-v,2020-03-26,18:05:00,True,"""Mimořádný čin."" Ministryně navrhla Zemanovi milost pro vězně za záchranu života",Vězeň z příbramské věznice svou pohotovou reakcí zachránil život zaměstnankyni na venkovním pracovišti.,/domaci//domaci/mimoradny-cin-ministryne-ocenila-zachranu-zivota-a-navrhla-v/r~e44517ba6f8011eaaabd0cc47ab5f122/,03-05-2020 19:48:28
r~560650326f6611ea842f0cc47ab5f122,confiscated-face-masks-imported-by-an-influential-representa,2020-03-26,17:13:00,False,Confiscated face masks imported by an influential Chinese representative in Czechia,Hundreds of thousands of masks imported by Zhou Lingjian ended up in the hands of a Czech reseller who tried to sell them to the government.,/domaci//domaci/confiscated-face-masks-imported-by-an-influential-representa/r~560650326f6611ea842f0cc47ab5f122/,03-05-2020 19:48:28
r~a75b48886f6211eab1110cc47ab5f122,schillerova-haji-opatreni-podle-zdravotniho-zakona,2020-03-26,16:52:00,True,"Schillerová hájí zákazy podle zdravotního zákona. Ušlý zisk ale nikdo nedostane, říká",Podle některých právníků a opozice se vláda chce zbavit odpovědnosti za úhradu škod.,/domaci//domaci/schillerova-haji-opatreni-podle-zdravotniho-zakona/r~a75b48886f6211eab1110cc47ab5f122/,03-05-2020 19:48:28
r~eef1d1e86f6311eaa7deac1f6b220ee8,v-thomayerove-nemocnici-se-nakazilo-13-duchodcu-hygiena-bude,2020-03-26,15:48:00,True,"V Thomayerově nemocnici se nakazilo 13 důchodců, hygiena bude situaci prověřovat","Výsledky testů byly nejprve negativní, ve středu nemocnice potvrdila 13 nakažených.",/domaci//domaci/v-thomayerove-nemocnici-se-nakazilo-13-duchodcu-hygiena-bude/r~eef1d1e86f6311eaa7deac1f6b220ee8/,03-05-2020 19:48:28
r~7e6672ae6de611ea95caac1f6b220ee8,koronavirus-stridava-pece-rodinny-advokat,2020-03-26,10:38:00,False,"Koronavirus zamával i se střídavou péčí. Dovolat se pomoci je těžké, říká advokátka","Někteří tatínkové odmítají dítě převzít, některé maminky ho zase vydat. A některé děti uvázly za hranicemi.",/domaci//domaci/koronavirus-stridava-pece-rodinny-advokat/r~7e6672ae6de611ea95caac1f6b220ee8/,03-05-2020 19:48:28
r~93a00ec46eb711eab1110cc47ab5f122,dva-lidi-a-dost-ministerstvoomezilo-verejne-setkavani-vetsic,2020-03-25,21:02:00,True,Dva lidé a dost. Ministerstvo zpřísnilo pobyt venku. Odjezd na chalupu zakázaný není,Nařízení ministerstva zdravotnictví má platnost do 1. dubna.,/domaci//domaci/dva-lidi-a-dost-ministerstvoomezilo-verejne-setkavani-vetsic/r~93a00ec46eb711eab1110cc47ab5f122/,03-05-2020 19:48:30
r~edf87a526ea611ea80e60cc47ab5f122,mezi-rizikove-skupiny-patri-i-bezdomovci,2020-03-25,19:30:00,False,Mezi rizikové skupiny patří i bezdomovci. Praha chce všem najít střechu nad hlavou,"Stres a strach zažívají bezdomovci, kteří kvůli leckdy špatné životosprávě a imunitě patří mezi rizikové skupiny nemoci Covid-19.",/domaci//domaci/mezi-rizikove-skupiny-patri-i-bezdomovci/r~edf87a526ea611ea80e60cc47ab5f122/,03-05-2020 19:48:30
r~4e1ad3b8644211ea842f0cc47ab5f122,halenka-odvolacka-policie,2020-03-25,18:27:00,False,"Neveřejný rozsudek: Generál neměl u soudu co dělat, ale jeho osvobození bylo unáhlené","Deník Aktuálně.cz získal neveřejný rozsudek, jenž kauzu generála Vladimíra Halenky, obžalovaného pro machinace s armádním majetkem, vrátil policii.",/domaci//domaci/halenka-odvolacka-policie/r~4e1ad3b8644211ea842f0cc47ab5f122/,03-05-2020 19:48:30
kulturni-zivot-se-zastavil-prezije-epidemii-koronaviru-ptejt,kultura,2020-03-25,16:49:00,True,"V létě už by život mohl být volnější, ale ne příznivý pro festivaly, říká Zaorálek",Ministr kultury Lubomír Zaorálek odpovídal na otázky čtenářů Aktuálně.cz.,/domaci//domaci/kultura/kulturni-zivot-se-zastavil-prezije-epidemii-koronaviru-ptejt/r~3420de3a6e8811eab408ac1f6b220ee8/,03-05-2020 19:48:30
r~ed3c4d226e9811ea8972ac1f6b220ee8,zeman-se-zucastni-kvetnove-prehlidky-v-moskve-pokud-ji-rusov,2020-03-25,14:21:00,False,"Zeman se zúčastní květnové přehlídky v Moskvě, pokud ji Rusové nezruší",Kreml zatím oslavy 75 let od konce druhé světové války kvůli šíření nového koronaviru neodvolal.,/domaci//domaci/zeman-se-zucastni-kvetnove-prehlidky-v-moskve-pokud-ji-rusov/r~ed3c4d226e9811ea8972ac1f6b220ee8/,03-05-2020 19:48:30
litvinov-pujde-do-karanteny-tvrdila-zena-v-poplasne-zprave,ustecky,2020-03-25,12:32:00,False,"Litvínov půjde do karantény, tvrdila žena v poplašné zprávě. Teď jí hrozí osm let","Obviněná žena z Litvínova vytvořila minulý týden na svém mobilu hlasovou zprávu, ve které tvrdila, že hygienici uzavřou Litvínov do karantény.",/domaci//regiony/ustecky/litvinov-pujde-do-karanteny-tvrdila-zena-v-poplasne-zprave/r~b531fa286e8711eab1110cc47ab5f122/,03-05-2020 19:48:30
r~72a3b51a6dc011eab408ac1f6b220ee8,prulom-v-lecbe-covid-19-remdesivir-skutecne-vypada-ze-je-uci,2020-03-25,11:09:00,False,"Remdesivir skutečně vypadá, že je účinný. Ale nevíme, zda i bezpečný, říká odborník","Látka, za jejímž vývojem stojí český vědec Tomáš Cihlář, prokázala na malém vzorku pacientů signifikantní výsledky.",/domaci//domaci/prulom-v-lecbe-covid-19-remdesivir-skutecne-vypada-ze-je-uci/r~72a3b51a6dc011eab408ac1f6b220ee8/,03-05-2020 19:48:30
r~3e4573e06e7d11ea9c800cc47ab5f122,na-ff-uk-konci-mluvci-kukal-kvuli-prispevkum-na-sitich,2020-03-25,11:03:00,False,Mluvčí Filozofické fakulty označil ženy v rouškách za perské princezny. V práci končí,"""Důvodem jsou mé příspěvky na sociálních sítích,"" řekl mluvčí Filozofické fakulty Univerzity Karlovy Petr Kukal.",/domaci//domaci/na-ff-uk-konci-mluvci-kukal-kvuli-prispevkum-na-sitich/r~3e4573e06e7d11ea9c800cc47ab5f122/,03-05-2020 19:48:30
r~6e43a97e692111eaaabd0cc47ab5f122,jan-zizka-bitva-u-sudomere,2020-03-25,09:50:00,False,U Sudoměře Žižka obstál vůči přesile. Historka o kladení závojů měla husity znevážit,Před 600 lety uplatnili husité na jihočeském bojišti pod vedením Jana Žižky obrannou taktiku za pomoci proslulé vozové hradby.,/domaci//domaci/jan-zizka-bitva-u-sudomere/r~6e43a97e692111eaaabd0cc47ab5f122/,03-05-2020 19:48:30
r~6f7fe7ca6e6811ea8b230cc47ab5f122,treti-mrazive-rano-v-rade-na-sumave-bylo-pres-minus-18-stupn,2020-03-25,08:32:00,True,Třetí mrazivé ráno v řadě. Na Šumavě bylo přes minus 18 stupňů,Od čtvrtka by se mělo oteplit.,/domaci//pocasi/treti-mrazive-rano-v-rade-na-sumave-bylo-pres-minus-18-stupn/r~6f7fe7ca6e6811ea8b230cc47ab5f122/,03-05-2020 19:48:30
r~2ba7c2006ae611ea8b230cc47ab5f122,rodice-skolaku-koronavirus-domaci-skola,2020-03-25,05:30:00,False,"Být rodičem školáků v době koronaviru. Někdo si užívá, jiní se obávají o existenci","Přečtěte si, jak zvládají situaci maminky, které musí doma pracovat, starat se o děti a suplovat učitelku.",/domaci//domaci/rodice-skolaku-koronavirus-domaci-skola/r~2ba7c2006ae611ea8b230cc47ab5f122/,03-05-2020 19:48:30
snemovna-schvalila-zvyseni-schodku-letosniho-rozpoctu-ze-40,ceska-ekonomika,2020-03-24,21:05:00,True,Sněmovna schválila zvýšení schodku letošního rozpočtu ze 40 na 200 miliard,"Příjmy rozpočtu tak proti původnímu plánu klesnou o 89,8 miliardy korun, naopak výdaje mají vzrůst o 70,2 miliardy korun.",/domaci//ekonomika/ceska-ekonomika/snemovna-schvalila-zvyseni-schodku-letosniho-rozpoctu-ze-40/r~b110f7806e0711ea8972ac1f6b220ee8/,03-05-2020 19:48:30
snemovna-jednani-v-mimoradne-provizornich-podminkach-vlade-s,politika,2020-03-24,21:03:00,True,"Pozastavení EET i odpuštění záloh. Poslanci pomůžou živnostníkům, zazněla modlitba",Elektronická evidence tržeb se pozastaví na dobu vyhlášeného stavu nouze a následující tři měsíce.,/domaci//domaci/politika/snemovna-jednani-v-mimoradne-provizornich-podminkach-vlade-s/r~4489ff366db611eab0f60cc47ab5f122/,03-05-2020 19:48:30
r~797b7b3c6def11ea9d74ac1f6b220ee8,prymula-nekde-se-pomucky-nerozdelily-dle-planu-na-lekare-nez,2020-03-24,17:54:00,False,Některé kraje respirátory nerozdělily podle plánu. Někde na lékaře nezbyly,Ochranný materiál místy nezbyl třeba na praktické lékaře či ambulantní specialisty.,/domaci//domaci/prymula-nekde-se-pomucky-nerozdelily-dle-planu-na-lekare-nez/r~797b7b3c6def11ea9d74ac1f6b220ee8/,03-05-2020 19:48:30
r~9d7d2bd06dda11ea9d470cc47ab5f122,pripad-michalakove-a-jejich-synu-bude-znovu-resit-soud,2020-03-24,17:12:00,True,"Případ Michalákové a jejích synů bude znovu řešit soud v Hodoníně, změní se soudce","Krajský soud vrátil případ k hodonínskému okresnímu soudu, který rozhodoval v březnu 2018. Soud tehdy norská rozhodnutí označil za dostatečná.",/domaci//domaci/pripad-michalakove-a-jejich-synu-bude-znovu-resit-soud/r~9d7d2bd06dda11ea9d470cc47ab5f122/,03-05-2020 19:48:30
r~cbf141906d1711eaa6f6ac1f6b220ee8,testovani-testovani-testovani,2020-03-24,16:29:00,False,"Testování v Česku stále vázne. Zrychlíme, lidé už nebudou dlouho čekat, tvrdí Prymula","""Kraje si udělaly poměrně hodně odběrových míst, ale nenavázaly na ně laboratoře,"" přiznal náměstek Prymula Aktuálně.cz.",/domaci//domaci/testovani-testovani-testovani/r~cbf141906d1711eaa6f6ac1f6b220ee8/,03-05-2020 19:48:30
r~e9a4e5746ddb11eaa25cac1f6b220ee8,cinska-ambasada-skupovala-v-cesku-respiratory-a-posilala-je,2020-03-24,15:42:00,False,"Čínská ambasáda skupovala v Česku respirátory a posílala je domů, varovala BIS","Kontrarozvědka BIS varovala vládu, že čínská ambasáda od ledna organizuje hromadné skupování respirátorů a posílá je do Číny.",/domaci//domaci/cinska-ambasada-skupovala-v-cesku-respiratory-a-posilala-je/r~e9a4e5746ddb11eaa25cac1f6b220ee8/,03-05-2020 19:48:31
r~d7d732666dae11ea9d74ac1f6b220ee8,ceske-zdravotnictvi-zvladne-az-30-tisic-nakazenych,2020-03-24,15:06:00,False,"České zdravotnictví zvládne 30 tisíc nakažených. Čím méně nemocných seniorů, tím lépe","Vládní odborníci odhadují, že koncem března budou v Česku tři tisíce nakažených. O měsíc později by jich mohlo být až patnáct tisíc.",/domaci//domaci/ceske-zdravotnictvi-zvladne-az-30-tisic-nakazenych/r~d7d732666dae11ea9d74ac1f6b220ee8/,03-05-2020 19:48:31
r~e48f55266dd411ea9c800cc47ab5f122,remdesivir-dostal-prvni-pacient-v-cesku-firma-vytvari-schema,2020-03-24,15:06:00,True,"Remdesiviru se k nám dostane možná pár stovek ampulí, léčí se jím už první Čech","Americká firma Gilead ve spolupráci se zdravotníky vytvoří schéma, podle nějž se experimentální lék remdesivir dostane k nejpotřebnějším pacientům.",/domaci//domaci/remdesivir-dostal-prvni-pacient-v-cesku-firma-vytvari-schema/r~e48f55266dd411ea9c800cc47ab5f122/,03-05-2020 19:48:31
r~cbbce5486dd111ea9d470cc47ab5f122,rada-zada-odskodneni-obeti-ochranneho-dohledu,2020-03-24,14:34:00,False,"Rada žádá odškodnění lidí, kteří byli pod dohledem, o němž psala Válková s Urválkem","Rada vlády pro lidská práva navrhla, aby stát odškodnil lidi, kteří museli za komunistického režimu strpět ochranný dohled z politických důvodů.",/domaci//domaci/rada-zada-odskodneni-obeti-ochranneho-dohledu/r~cbbce5486dd111ea9d470cc47ab5f122/,03-05-2020 19:48:31
r~7b1dfaee6d1511ea80e60cc47ab5f122,bagety-vymenili-za-rousky-kopirujte-nas-vyzyva-konkurenci-ma,2020-03-24,13:16:00,False,"Místo baget prodávají roušky. Kopírujte nás, vyzývá konkurenci majitel rouškomatu","První dva rouškomaty jsou nyní v provozu ve Vyškově. Rouška v nich stojí 50 korun, které půjdou na charitu.",/domaci//domaci/bagety-vymenili-za-rousky-kopirujte-nas-vyzyva-konkurenci-ma/r~7b1dfaee6d1511ea80e60cc47ab5f122/,03-05-2020 19:48:31
r~2ba521ae6db511ea8972ac1f6b220ee8,okamura-u-ustavniho-soudu-uspel-prezdivka-pitomio-je-podle-s,2020-03-24,11:10:00,False,"Okamura u Ústavního soudu uspěl, přezdívka Pitomio je podle soudu cílené zesměšňování",Jeho žalobu kvůli přezdívce v časopisu Reflex musí znovu řešit Městský soud v Praze.,/domaci//domaci/okamura-u-ustavniho-soudu-uspel-prezdivka-pitomio-je-podle-s/r~2ba521ae6db511ea8972ac1f6b220ee8/,03-05-2020 19:48:31
r~dfeac4686cf511eaaabd0cc47ab5f122,hackathon-plicnich-ventilatoru-vyrobime-jich-500-za-tri-tydn,2020-03-24,10:10:00,False,Vyrobíme 500 plicních ventilátorů do tří týdnů. Nadšenci chtějí předejít nedostatku,"Ačkoli je plicních ventilátorů v Česku zatím dostatek, skupina odborníků už pracuje na projektu, který by měl pomoct předejít italskému scénáři.",/domaci//domaci/hackathon-plicnich-ventilatoru-vyrobime-jich-500-za-tri-tydn/r~dfeac4686cf511eaaabd0cc47ab5f122/,03-05-2020 19:48:31
r~4e1b3a486d4211eaa6f6ac1f6b220ee8,vyjimecna-opatreni-mohou-trvat-dele-nez-vlada-cekala-odpustt,2020-03-23,22:35:00,True,"Výjimečná opatření mohou trvat déle, než vláda čekala. Odpusťte nám chyby, řekl Babiš","Podle premiéra vláda i státní instituce dělají to nejlepší, co je možné, pro ochranu životů a zdraví občanů.",/domaci//domaci/vyjimecna-opatreni-mohou-trvat-dele-nez-vlada-cekala-odpustt/r~4e1b3a486d4211eaa6f6ac1f6b220ee8/,03-05-2020 19:48:31
,r~f06ba4f66d3111eab115ac1f6b220ee8,2020-03-23,19:58:00,False,"Maturitu i přijímačky zvládneme, zní ze škol. Obávají se ale studijní morálky dětí",Co si o nových rozhodnutích ministerstva školství myslí odborníci? A jak nahlížejí na současnou krizovou situaci? Co udělá se žáky?,/domaci//maturitu-i-prijimacky-zvladneme-rikaji-experti-obavaji-se-al/r~f06ba4f66d3111eab115ac1f6b220ee8/,03-05-2020 19:48:31
r~ef19d70c6cfb11eaaabd0cc47ab5f122,nejvyssi-ochrana-levnejsi-vyroba-cesky-respirator-z-tiskarny,2020-03-23,19:45:00,False,"Čeští vědci mají respirátory z 3D tiskáren za pouhý týden. Malý zázrak, říká expertka","Výroba se rozběhne už příští týden na sedmi speciálních 3D tiskárnách, které budou moci vyprodukovat 400 až 500 kusů denně.",/domaci//domaci/nejvyssi-ochrana-levnejsi-vyroba-cesky-respirator-z-tiskarny/r~ef19d70c6cfb11eaaabd0cc47ab5f122/,03-05-2020 19:48:31
r~d66720a66cfc11eaa25cac1f6b220ee8,byznysmen-rozjel-sbirku-na-boj-proti-koronaviru-za-kterou-do,2020-03-23,19:20:00,False,"Byznysmen rozjel sbírku na boj proti koronaviru, za kterou dostal primář přes prsty","Jménem primáře z VFN se šířila výzva, aby lidé posílali peníze na přístroje. Po výtce primář iniciativu upravil a podpora už proudí standardní cestou.",/domaci//domaci/byznysmen-rozjel-sbirku-na-boj-proti-koronaviru-za-kterou-do/r~d66720a66cfc11eaa25cac1f6b220ee8/,03-05-2020 19:48:31
r~d101aefc6d2d11ea95caac1f6b220ee8,pokud-se-skoly-neotevrou-do-cervna-maturity-nebudou-prazdnin,2020-03-23,18:52:00,False,"Pokud se školy neotevřou do června, studenti maturovat nebudou, rozhodne vysvědčení","Pokud se studenti vrátí do škol před 1. červnem, budou u maturity oproštěni od slohové práce z češtiny a angličtiny.",/domaci//domaci/pokud-se-skoly-neotevrou-do-cervna-maturity-nebudou-prazdnin/r~d101aefc6d2d11ea95caac1f6b220ee8/,03-05-2020 19:48:31
r~bc858c266cfd11eaa25cac1f6b220ee8,praha-5-protizakonne-objednala-predrazene-respiratory,2020-03-23,18:25:00,False,Radnice Prahy 5 si protizákonně objednala předražené respirátory od schránkové firmy,"Radnice za jeden respirátor slíbila 500 korun, což je o třetinu více, než dovoluje ministerské nařízení. Hrozí jí za to pokuta až 10 milionů.",/domaci//domaci/praha-5-protizakonne-objednala-predrazene-respiratory/r~bc858c266cfd11eaa25cac1f6b220ee8/,03-05-2020 19:48:31
r~ffb8c3ee6d1811ea95caac1f6b220ee8,zastavme-vyrobu-zdravi-je-vice-nez-zisk-volaji-odbory-nevkus,2020-03-23,17:27:00,False,"Zastavme výrobu, zdraví je více než zisk, volají odbory. Nevkusné, kontruje Dlouhý","Nabádání firem, aby se vzdaly zisku pro ochranu zdraví a života zaměstnanců je podle Dlouhého ""nevkusně populistické a na hraně zdravého rozumu"".",/domaci//ekonomika/zastavme-vyrobu-zdravi-je-vice-nez-zisk-volaji-odbory-nevkus/r~ffb8c3ee6d1811ea95caac1f6b220ee8/,03-05-2020 19:48:31
r~43dc9a3e6d1711ea842f0cc47ab5f122,praktikum-chybi-respiratory-zaviraji-ordinace-neni-to-riziko,2020-03-23,16:29:00,False,"Praktikům chybí respirátory, zavírají ordinace. Není to riziko? Jejich šéf odpovídal",Na otázky čtenářů Aktuálně.cz odpovídal předseda Sdružení praktických lékařů Petr Šonka.,/domaci//domaci/praktikum-chybi-respiratory-zaviraji-ordinace-neni-to-riziko/r~43dc9a3e6d1711ea842f0cc47ab5f122/,03-05-2020 19:48:31
r~84235f126d0611ea80e60cc47ab5f122,zufanek-dezinfekce,2020-03-23,16:23:00,False,"Zakázali mi vyrábět dezinfekci, stěžuje si Žufánek. O povolení nestál, říkají celníci","Lihovar Žufánek začal bez povolení vyrábět dezinfekční gel. Po upozornění celníků si majitel postěžoval na Facebooku, vstřícnost úřadů poté odmítl.",/domaci//ekonomika/zufanek-dezinfekce/r~84235f126d0611ea80e60cc47ab5f122/,03-05-2020 19:48:31
r~713024046d0511ea80e60cc47ab5f122,kdo-je-ten-nakazeny-ptaji-se-lide-starostu-vlada-se-boji-lyn,2020-03-23,16:19:00,False,"Je můj soused nakažený? ptají se lidé. Vláda údaje o obcích nedá, chrání nemocné","Starostové požadují, aby hygienici zveřejňovali počty nakažených po obcích. Ministerstvo to však odmítá, chce nemocné ochránit před stigmatizací.",/domaci//domaci/kdo-je-ten-nakazeny-ptaji-se-lide-starostu-vlada-se-boji-lyn/r~713024046d0511ea80e60cc47ab5f122/,03-05-2020 19:48:31
r~49a254b66cfb11ea842f0cc47ab5f122,rychlotesty-na-koronavirus-mely-chybovost-80-procent-odhalil,2020-03-23,12:51:00,False,"Rychlotesty na koronavirus mají chybovost 80 procent, odhalili lékaři na Ostravsku","Testy není zdravotníci nejspíš použijí u lidí, kteří jsou v karanténě, ale nebyli nikdy testováni.",/domaci//domaci/rychlotesty-na-koronavirus-mely-chybovost-80-procent-odhalil/r~49a254b66cfb11ea842f0cc47ab5f122/,03-05-2020 19:48:33
r~66de3b266cf611eaa7deac1f6b220ee8,prijimaci-zkousky-budou-jednokolove-a-maturita-bez-pisemne,2020-03-23,12:30:00,False,"Přijímací zkoušky budou jednokolové a maturita bez písemné části, navrhuje Plaga","Ministerstvo předpokládá, že by se žáci mohli do škol vrátit v druhé polovině května.",/domaci//domaci/prijimaci-zkousky-budou-jednokolove-a-maturita-bez-pisemne/r~66de3b266cf611eaa7deac1f6b220ee8/,03-05-2020 19:48:33
r~236e95e069c511ea80e60cc47ab5f122,opozice-koronavirus-odmita-kitiku-premier,2020-03-23,12:16:00,False,"Snažíme se během krize také pomáhat, tvrdí opoziční lídři. Odmítají Babišovu kritiku",Deník Aktuálně.cz zmapoval chování opozice v době koronavirové krize.,/domaci//domaci/opozice-koronavirus-odmita-kitiku-premier/r~236e95e069c511ea80e60cc47ab5f122/,03-05-2020 19:48:33
r~87df8a106cf011eab115ac1f6b220ee8,na-sumave-silne-mrzlo-teplota-u-hojsovy-straze-klesla-temer,2020-03-23,11:41:00,False,"Mrazivá noc v Česku. Na Jezerní slati na Šumavě naměřili minus 22,1 stupně",Na šumavských slatích klesla rtuť teploměru k téměř minus 20 stupňům,/domaci//pocasi/na-sumave-silne-mrzlo-teplota-u-hojsovy-straze-klesla-temer/r~87df8a106cf011eab115ac1f6b220ee8/,03-05-2020 19:48:33
r~bcfeb86a6ce611ea9d74ac1f6b220ee8,ct3,2020-03-23,11:15:00,False,"ČT3 hlásí spuštěno. Podívejte se, jak naladit televizi pro seniory v nelehké době","Stanice ČT3 vznikla během jednoho týdne. Seniorům nabídne ""prověřené"" seriály i informace. V pozemním vysílání bude jen v novém formátu DVB-T2.",/domaci//ekonomika/ct3/r~bcfeb86a6ce611ea9d74ac1f6b220ee8/,03-05-2020 19:48:33
r~70d939626ce411eaaabd0cc47ab5f122,rath-ma-narok-na-poslanecke-nahrady-za-obdobi-kdy-byl-ve-vaz,2020-03-23,10:11:00,False,"Rath má nárok na poslanecké náhrady za období, kdy byl ve vazbě, tvrdí Nejvyšší soud","V době, kdy byl tehdejší poslanec ČSSD Rath omezený na svobodě, mu dolní komora parlamentu vyplácela plat, nikoliv však víceúčelové paušální náhrady.",/domaci//domaci/rath-ma-narok-na-poslanecke-nahrady-za-obdobi-kdy-byl-ve-vaz/r~70d939626ce411eaaabd0cc47ab5f122/,03-05-2020 19:48:33
r~81c8991c6c1b11eab1110cc47ab5f122,online-koronavirus-karantena-cesko,2020-03-23,07:42:00,True,"V Česku zemřel na koronavirus první člověk, Babiš chce znovu změnit nákupy pro starší",Události v souvislosti s šířením koronaviru sledujeme on-line.,/domaci//domaci/online-koronavirus-karantena-cesko/r~81c8991c6c1b11eab1110cc47ab5f122/,03-05-2020 19:48:33
